{
  "schema_version": 1,
  "mode": "ab",
  "layout_request": {},
  "resolved_layout": {
    "mode": "ab",
    "efi_size_mb": 1024,
    "root_size_mb": null,
    "root_a_size_mb": 20480,
    "root_b_size_mb": 20480,
    "state_size_mb": null
  },
  "disk": {
    "path": "/dev/vda",
    "size_bytes": 268435456000,
    "logical_sector_bytes": 512,
    "physical_sector_bytes": 4096
  },
  "partitions": [
    {"index": 1, "name": "efi", "filesystem": "vfat", "label": "EFI", "gpt_type": "U", "size_mb": 1024, "mountpoint": "/boot"},
    {"index": 2, "name": "root_a", "filesystem": "ext4", "label": "ROOT_A", "gpt_type": "L", "size_mb": 20480, "mountpoint": "/slots/A"},
    {"index": 3, "name": "root_b", "filesystem": "ext4", "label": "ROOT_B", "gpt_type": "L", "size_mb": 20480, "mountpoint": "/slots/B"},
    {"index": 4, "name": "state", "filesystem": "ext4", "label": "STATE", "gpt_type": "L", "size_mb": null, "mountpoint": "/state"}
  ],
  "sfdisk_script": "label: gpt\n,1024M,U,*\n,20480M,L\n,20480M,L\n,,L\n"
}
